1544|銅|14|"Kane, Kanehen"|33|ドウ||doo|copper|-|-|10149
38|緯|16|"Ito, Itohen"|63|イ|よこいと|i|"woof; horizontal; left and right; parallels of latitude; latitude"|-|-|10135
1717|氷|5|"Mizu, Sanzui, Shitamizu"|118|ヒョウ、こおり、ひ|こお|hyoo|"freeze; be frozen over; congeal"|"koori, hi"|"ice; shaved ice. hail"|10116
1535|騰|20|"Uma, Umahen"|11|トウ|あ|too|"rising; price rise"|-|-|10096
297|眼|11|"Me, Mehen"|19|ガン、[ゲン]、まなこ|め|"gan, [gen]"|"eye; look, gaze; notice, attention; viewpoint; discrimination, insight; experience; treatment; care, favor, pity; texture, weave; mesh; grain, square; sight, vision; tooth (of a saw); weight; eye (of a needle)"|manako|eye|10059
1520|棟|12|"Ki, Kihen"|85|トウ、むね、[むな]||too|"ridge, ridgepole; counter for buildings"|"mune, [muna]"|"ridge, ridgepole; counter for buildings"|10052
1948|黙|15|Kuro|2|モク、だま-る|もだ|moku|"keeping silence"|dama(ru)|"become silent, stop speaking, say nothing "|10043
1728|猫|11|"Inu, Kemonohen"|17|ビョウ、ねこ|ミョウ|byoo|cat|neko|cat|10029
925|熟|15|"Hi, Hihen, Renga"|26|ジュク、う-れる||juku|"ripen, mellow, mature; acquire skill; be ripe for; become popular (as a word)"|u(reru)|"ripen, mellow, mature; acquire skill; be ripe for; become popular (as a word)"|9991
1205|阻|8|Kozatohen|31|ソ、はば-む||so|"separate from; prevent, stop"|haba(mu)|"obstruct, prevent, impede, deter, hinder, thwart, resist, frustrate"|9986
2111|炉|8|"Hi, Hihen, Renga"|26|ロ||ro|"furnace, kiln, hearth; (nuclear) reactor"|-|-|9982
1650|髪|14|Kamigashira|1|ハツ、かみ||hatsu|"the hair"|kami|"the hair"|9931
687|唆|10|"Kuchi, Kuchihen"|70|サ、そそのか-す||sa|"tempt, seduce; instigate; promote"|sosonoka(su)|"tempt, seduce; instigate; promote"|9869
1828|簿|19|"Take, Takekanmuri"|24|ボ||bo|"record, book"|-|-|9855
54|陰|11|Kozatohen|31|イン、かげ、かげ-る||in|"the yin principle; negative; melancholy; north side of a mountain; sex organs; secret; shadow; south side of a river; negative electrode; earth; bottom; back; inactivity; nighttime; moon"|"kage, kage(ru)"|"darken; cloud up; be obscured; shade; back; (your) assistance"|9803
924|塾|14|"Tsuchi, Tsuchihen"|50|ジュク||juku|"private school; boarding school; gate house"|-|-|9799
2007|踊|14|"Ashi, Ashihen"|11|ヨウ、おど-る、おど-り||yoo|"dance; leap, skip; throb (the heart); act as a cat's-paw; double (the interest on a debt)"|"odo(ru), odo(ri)"|"dance; leap, skip; throb (the heart); act as a cat's-paw; double (the interest on a debt). dancing; step"|9796
363|丘|5|Ichi|14|キュウ、おか|ク|kyuu|"hill, knoll, rising ground"|oka|"hill, knoll, rising ground"|9788
416|鏡|19|"Kane, Kanehen"|33|キョウ、かがみ||kyoo|"mirror; speculum; barrelhead; round rice-cake offering"|kagami|"mirror; speculum; barrelhead; round rice-cake offering"|9692
128|恩|10|"Kokoro, Risshinben, Shitagokoro"|76|オン||on|"kindness, goodness, favor, mercy, blessing, benefit"|-|-|9650
1401|彫|11|Sanzukuri|5|チョウ、ほ-る|え|choo|carving|ho(ru)|"carve, engrave, sculpture, inscribe"|9569
1825|墓|13|"Tsuchi, Tsuchihen"|50|ボ、はか||bo|"grave, tomb"|haka|"grave, tomb"|9482
1288|妥|7|"Onna, Onnahen"|36|ダ||da|"peace; depravity"|-|-|9430
1868|棒|12|"Ki, Kihen"|85|ボウ||boo|"stick, cane, rod, pole, stake, pile, club, bar; line, dash"|-|-|9428
751|傘|12|"Hito, Ninben, Hitoyane"|104|サン、かさ||san|"umbrella, parasol"|kasa|"umbrella, parasol"|9416
2120|浪|10|"Mizu, Sanzui, Shitamizu"|118|ロウ|なみ|roo|"waves, billows"|-|-|9388
194|懐|16|"Kokoro, Risshinben, Shitagokoro"|76|カイ、ふところ、なつ-かしい、なつ-かしむ、なつ-く、なつ-ける|いだ|kai|"heart, feeling"|"futokoro, natsu(kashii), natsu(kashimu), natsu(ku), natsu(keru)"|"bosom, breast, heart; pocket, purse; dear, longed-for; yearning for; yearn for, miss someone; win over, win another’s heart; become attached to"|9364
1055|浸|10|"Mizu, Sanzui, Shitamizu"|118|シン、ひた-す、ひた-る|し|shin|"soak, dip, steep, immerse, moisten, wet, dunk, drench"|"hita(su), hita(ru)"|"soak, dip, steep, immerse, moisten, wet, dunk, drench. be soaked in, be immersed in, be flooded, be submerged; be bathed in; be addicted to "|9359
1689|披|8|Tehen|89|ヒ||hi|open|-|-|9342
1632|拍|8|Tehen|89|ハク、[ヒョウ]||"haku, [hyoo]"|"beat (in music)"|-|-|9328
1916|脈|10|"Niku, Nikuzuki"|44|ミャク||myaku|"vein (of ore); blood vessel; pulse; pulsation; hope"|-|-|9303
1113|征|8|Gyooninben|19|セイ|い、ゆ|sei|"attack the rebellious; collect taxes"|-|-|9302
1715|姫|10|"Onna, Onnahen"|36|ひめ|キ|-|-|hime|"princess; young lady of birth. little, pretty"|9289
1588|妊|7|"Onna, Onnahen"|36|ニン||nin|"become pregnant; be pregnant; be filled with"|-|-|9254
2095|霊|15|"Ame, Amekanmuri"|13|レイ、リョウ、たま||"rei, 	ryoo"|"soul, spirit"|tama|"soul, spirit"|9218
1369|蓄|13|Kusakanmuri|47|チク、たくわ-える||chiku|"store, hoard, savings"|takuwa(eru)|"store, lay in stock, save, wear (a mustache)"|9211
1690|肥|8|"Niku, Nikuzuki"|44|ヒ、こ-える、こえ、こ-やす、こ-やし||hi|"get fat; get fertile"|"ko(eru), koe,ko(yasu), ko(yashi)"|"get fat; get fertile. fertilize, enrich; fatten; feather one's nest; pamper one's taste. manure, fertilizer. night soil "|9128
311|祈|8|"Shimesu, Shimesuhen"|15|キ、いの-る||ki|"pray; wish"|ino(ru)|"pray; wish"|8956
93|媛|12|"Onna, Onnahen"|36|エン|ひめ|en|"princess; young lady of noble birth"|-|-|8956
1784|奮|16|Dai|16|フン、ふる-う||fun|"be invigorated, be spirited, flourish"|furu(u)|"be invigorated, be spirited, flourish"|8951
1098|据|11|Tehen|89|す-える、す-わる||-|-|"su(eru), su(waru)"|"set (a table); lay (a foundation); place (a gun); install, equip; appoint (to a position). squat down, sit down, (eyes) are fixed on"|8837
1024|壌|16|"Tsuchi, Tsuchihen"|50|ジョウ||joo|"earth, soil"|-|-|8836
1403|釣|11|"Kane, Kanehen"|33|チョウ、つ-る||choo|"angle, fish, catch; decoy, allure "|tsu(ru)|"angle, fish, catch; decoy, allure "|8825
1033|殖|12|Kabanehen|5|ショク、ふ-える、ふ-やす||shoku|increase|"fu(eru), fu(yasu)"|"increase, multiply, accrue; (water) rises. add to, raise, augment"|8812
464|勲|15|Chikara|23|クン|いさお|kun|"merit, order of merit"|-|-|8799
220|隔|13|Kozatohen|31|カク、へだ-てる、へだ-たる||kaku|"distance, every other, alternate "|"heda(teru), heda(taru)"|"separate, interpose; screen, shield; estrange; be distant from, be separated from, become estranged"|8796
109|往|8|Gyooninben|19|オウ|い、ゆ|oo|"let go; chase away"|-|-|8776
467|郡|10|Oozato|12|グン|こおり、ごおり|gun|"county, district"|-|-|8772
1842|峰|10|"Yama, Yamahen"|16|ホウ、みね|ブ、プ|hoo|"peak, summit, top; back (of a sword)"|mine|"peak, summit, top; back (of a sword)"|8727
1894|魔|21|"Oni, Kinyoo"|4|マ||ma|"demon, devil, evil spirit"|-|-|8668
1446|貞|9|"Kai, Kaihen"|35|テイ|ジョウ|tei|"chastity; constancy; righteousness"|-|-|8656
1093|随|12|Kozatohen|31|ズイ|したが|zui|"at the mercy of (the waves)"|-|-|8586
1667|班|10|"Tama, Oo"|15|ハン||han|"corps, unite, squad; party, companions, group; order"|-|-|8584
1410|跳|13|"Ashi, Ashihen"|11|チョウ、は-ねる、と-ぶ||choo|"leap, spring up; hop; jerk, prance, buck; bound; spatter, splash; snap, crack, sputter; close, be over "|"ha(neru), to(bu)"|"leap, spring up; hop; jerk, prance, buck; bound; spatter, splash; snap, crack, sputter; close, be over. jump, spring, bound, vault, hop "|8562
1856|妨|7|"Onna, Onnahen"|36|ボウ、さまた-げる||boo|"disturb, prevent, hamper, hinder, obstruct"|samata(geru)|"disturb, prevent, hamper, hinder, obstruct"|8528
2102|劣|6|Chikara|23|レツ、おと-る||retsu|"be inferior to, be worse than"|oto(ru)|"be inferior to, be worse than"|8527
1016|浄|9|"Mizu, Sanzui, Shitamizu"|118|ジョウ|きよ|joo|"clean, clear; pure, innocent, noble"|-|-|8463
935|准|10|Nisui|6|ジュン||jun|"quasi-, semi-, associate"|-|-|8450
319|鬼|10|"Oni, Kinyoo"|4|キ、おに||ki|"devil, demon; spirits of the dead"|oni|"devil, demon, ghost; spirits of the dead; fiend; creditor; the one who is ""it"" (in games)"|8447
227|岳|8|"Yama, Yamahen"|16|ガク、たけ||gaku|"peak, mountain"|take|"peak, mountain"|8436
1586|尿|7|Shikabane|15|ニョウ||nyoo|urine|-|-|8379
1625|培|11|"Tsuchi, Tsuchihen"|50|バイ、つちか-う||bai|"cultivate, foster"|tsuchika(u)|"cultivate, foster"|8322
2103|烈|10|"Hi, Hihen, Renga"|26|レツ|はげ|retsu|"violent, vehement, furious, severe, acute, intense, extreme, passionate, heated, stormy (applause); tempestuous (temperament); mighty "|-|-|8297
1017|剰|11|"Katana, Rittoo"|32|ジョウ|あま|joo|besides|-|-|8262
640|鉱|13|"Kane, Kanehen"|33|コウ|あらがね|koo|ore|-|-|8258
2110|呂|7|"Kuchi, Kuchihen"|70|ロ|リョ|ro|backbone|-|-|8251
36|慰|15|"Kokoro, Risshinben, Shitagokoro"|76|イ、なぐさ-める、なぐさ-む||i|"amuse oneself; make sport of; seduce"|"nagusa(meru), nagusa(mu)"|"amuse oneself; make sport of; seduce; comfort, console, cheer"|8249
2131|賄|13|"Kai, Kaihen"|35|ワイ、まかな-う||wai|"board; supply; finance"|makana(u)|"board; supply; finance"|8215
791|脂|10|"Niku, Nikuzuki"|44|シ、あぶら||shi|"fat, rouge"|abura|"fat, grease, tallow, blubber, lard, suet"|8175
948|暑|12|"Nichi, Nichihen"|38|ショ、あつ-い||sho|"summer heat"|atsu(i)|"hot, warm, sultry"|8110
1340|淡|11|"Mizu, Sanzui, Shitamizu"|118|タン、あわ-い||tan|"light, faint, pale, fleeting; a little"|awa(i)|"light, faint, pale, fleeting; a little"|8092
772|糸|6|"Ito, Itohen"|63|シ、いと||shi|"thread; one ten-thousandth of a hair"|ito|"thread, yarn; gut; string (of a violin); (fish) line  "|8069
1515|悼|11|"Kokoro, Risshinben, Shitagokoro"|76|トウ、いた-む||too|"grieve over"|ita(mu)|"grieve over"|8033
989|晶|12|"Nichi, Nichihen"|38|ショウ|あき|shoo|"clear, crystal"|-|-|8021
238|葛|12|Kusakanmuri|47|カツ、くず|つづら、かずら|katsu|"arrowroot, a strong-fiber vine"|kuzu|"arrowroot; arrowroot starch"|7997
1719|俵|10|"Hito, Ninben, Hitoyane"|104|ヒョウ、たわら||hyoo|"bag, bale, sack; bag counter"|tawara|"bag, bale, sack; bag counter"|7992
1519|搭|12|Tehen|89|トウ||too|"load (a vehicle); ride"|-|-|7983
1983|憂|15|"Kokoro, Risshinben, Shitagokoro"|76|ユウ、うれ-える、うれ-い、う-い||yuu|"grieve, lament, be anxious"|"ure(eru), ure(i), u(i)"|"grieve, lament, be anxious. sad, unhappy, gloomy. distress, sorrow, trouble, anxiety, grief"|7942
2041|履|15|Shikabane|15|リ、は-く|くつ|ri|"trample on, stamp on; carry through, practice; appraise; set foot on; evade payment; step on"|ha(ku)|"put on (the feet)"|7881
1500|灯|6|"Hi, Hihen, Renga"|26|トウ、ひ|ドン、ともしび、あかし|too|"lamp, light; counter for lights"|hi|"a light"|7879
1354|壇|16|"Tsuchi, Tsuchihen"|50|ダン、[タン]||"dan, [tan]"|"stage, rostrum, dais; terrace; altar; world (of literature, etc.)"|-|-|7863
335|畿|15|"Ta, Tahen"|19|キ||ki|"capital; capital suburbs"|-|-|7830
749|惨|11|"Kokoro, Risshinben, Shitagokoro"|76|サン、ザン、みじ-め||"san, 	zan"|"disaster; cruelty; wretchedness"|miji(me)|"sad, pitiful, wretched"|7809
302|伎|6|"Hito, Ninben, Hitoyane"|104|キ||ki|"deed, skill"|-|-|7779
185|械|11|"Ki, Kihen"|85|カイ||kai|"fetters; machine; instrument"|-|-|7760
259|乾|11|"Otsu, Otsunyoo"|7|カン、かわ-く、かわ-かす|いぬい、ほ、ぼ|kan|"heaven; emperor"|"kawa(ku), kawa(kasu)"|"dry, dry up; be dry; desiccate"|7656
1754|腐|14|"Niku, Nikuzuki"|44|フ、くさ-る、くさ-れる、くさ-らす||fu|"rot, decay; turn sour; fester; corrode; be corrupted; feel gloomy "|"kusa(ru), kusa(reru), kusa(rasu)"|"rot, decay; turn sour; fester; corrode; be corrupted; feel gloomy. let spoil, rot, corrode, addle "|7603
396|叫|6|"Kuchi, Kuchihen"|70|キョウ、さけ-ぶ||kyoo|"shout, exclaim, cry, yell, roar, howl; cry for, clamor for, advocate"|sake(bu)|"shout, exclaim, cry, yell, roar, howl; cry for, clamor for, advocate"|7581
1047|辛|7|Karai|3|シン、から-い|つら、づら|shin|"H, eighth"|kara(i)|"hot, acrid, sharp; salty; bitter, trying; harsh, severe"|7570
1722|漂|14|"Mizu, Sanzui, Shitamizu"|118|ヒョウ、ただよ-う||hyoo|"float (on the water)"|tadayo(u)|"float (on the water)"|7559
2073|糧|18|"Kome, Komehen"|10|リョウ、[ロウ]、かて||"ryoo, [roo]"|"food, provisions, bread"|kate|"food, provisions, bread"|7529
546|幻|4|Itogashira|4|ゲン、まぼろし||gen|"vision, dream; illusion, apparition"|maboroshi|"vision, dream; illusion, apparition"|7517
1631|伯|7|"Hito, Ninben, Hitoyane"|104|ハク||haku|"count; earl; eldest brother; uncle; chief official"|-|-|7502
593|巧|5|"E, Takumihen"|4|コウ、たく-み||koo|skilled|taku(mi)|"skill, ingenuity"|7473
1132|誓|14|"Gon, Gonben"|68|セイ、ちか-う||sei|"swear, plegde, vow"|chika(u)|"swear, plegde, vow"|7426
497|鶏|19|Tori|4|ケイ、にわとり|どり|kei|chicken|niwatori|chicken|7422
1679|晩|12|"Nichi, Nichihen"|38|バン||ban|"evening, night; the end of all things; late"|-|-|7374
1445|亭|9|Nabebuta|5|テイ|チン|tei|"restaurant; mansion; arbor; cottage; vaudeville, music hall, stage name"|-|-|7372
1711|匹|4|Kakushigamae|4|ヒツ、ひき|ピキ|hitsu|"head, counter (small animals); roll of cloth "|hiki|"head, counter (small animals); roll of cloth "|7370
1231|巣|11|Tsukanmuri|4|ソウ、す||soo|"nest, rookery, breeding place, beehive, cobweb; den, haunt"|su|"nest, rookery, breeding place, beehive, cobweb; den, haunt"|7348
2034|欄|20|"Ki, Kihen"|85|ラン||ran|"column (in a newspaper); blank; space; railing"|-|-|7275
1591|寧|14|Ukanmuri|36|ネイ|やす、むし|nei|preferably|-|-|7265
79|疫|9|Yamaidare|15|エキ、[ヤク]||"eki, [yaku]"|epidemic|-|-|7208
1794|陛|10|Kozatohen|31|ヘイ||hei|"steps (of the throne)"|-|-|7194
542|顕|18|Oogai|22|ケン|あらわ、あき|ken|"appear, emerge, come in sight, show up; be revealed, be discovered; be mentioned; become famous"|-|-|7188
2023|雷|13|"Ame, Amekanmuri"|13|ライ、かみなり||rai|thunder|kaminari|thunder|7169
1246|遭|14|Shinnyoo|51|ソウ、あ-う||soo|"meet, interview"|a(u)|"meet, interview"|7168
853|邪|8|Oozato|12|ジャ|よこしま、や|ja|"injustice, unrighteousness, wickedness"|-|-|7111
1448|訂|9|"Gon, Gonben"|68|テイ||tei|"correct; decide"|-|-|7111
1087|衰|10|"Koromo, Koromohen"|21|スイ、おとろ-える||sui|"decline, wane, weaken, abate, decay, wither, waste away"|otoro(eru)|"decline, wane, weaken, abate, decay, wither, waste away"|7105
1673|搬|13|Tehen|89|ハン||han|"carry, transport"|-|-|7087
407|恭|10|"Kokoro, Risshinben, Shitagokoro"|76|キョウ、うやうや-しい|ク|kyoo|"respectful, reverent"|uyauya(shii)|"respectful, reverent"|7071
1453|堤|12|"Tsuchi, Tsuchihen"|50|テイ、つつみ||tei|"dike, bank, embankment"|tsutsumi|"dike, bank, embankment"|7046
1888|翻|18|Hane|6|ホン、ひるがえ-る、ひるがえ-す||hon|"turn over, wave, flutter "|"hirugae(ru), hirugae(su)"|"turn over, wave, flutter. change (one's mind); turn, reverse; wave, dodge "|7024
260|勘|11|Chikara|23|カン||kan|"perception, intuition; the sixth sense"|-|-|7017
539|謙|17|"Gon, Gonben"|68|ケン|へりくだ|ken|"humble oneself, condescend, be modest"|-|-|7011
526|軒|10|"Kuruma, Kurumahen"|15|ケン、のき||ken|"house counter"|noki|eaves|6963
1491|塗|13|"Tsuchi, Tsuchihen"|50|ト、ぬ-る|まみ|to|"paint; plaster; daub, lacquer "|nu(ru)|"paint; plaster; daub, lacquer "|6955
2066|陵|11|Kozatohen|31|リョウ、みささぎ||ryoo|"imperial tomb"|misasagi|"imperial tomb"|6911
993|粧|12|"Kome, Komehen"|10|ショウ|よそお|shoo|"adorn (one's person)"|-|-|6876
941|潤|15|"Mizu, Sanzui, Shitamizu"|118|ジュン、うるお-う、うるお-す、うる-む||jun|"be watered; profit by, receive benefits, become rich "|"uruo(u), uruo(su), uru(mu)"|"be watered; profit by, receive benefits, become rich. moisten, water, irrigate, dip; enrich, profit. be dimmed, be clouded, get muddy; be wet  "|6871
963|匠|6|Hakogamae|2|ショウ|たくみ|shoo|"workman, artisan; means; idea"|-|-|6864
890|拾|9|Tehen|89|シュウ、ジュウ、ひろ-う||"shuu, 	juu"|ten|hiro(u)|"pick up, gather; find; set (type); go on foot "|6834
1371|秩|10|"Nogi, Nogihen"|23|チツ||chitsu|"salary; order"|-|-|6831
1646|肌|6|"Niku, Nikuzuki"|44|はだ|キ|-|-|hada|"skin, body; grain, texture; disposition"|6826
794|詞|12|"Gon, Gonben"|68|シ|ことば|shi|"words; poetry"|-|-|6812
1363|稚|13|"Nogi, Nogihen"|23|チ|いと、わか|chi|young|-|-|6806
246|刈|4|"Katana, Rittoo"|32|か-る||-|-|ka(ru)|"cut, clip; shear; reap; trim, prune"|6788
130|穏|16|"Nogi, Nogihen"|23|オン、おだ-やか||on|"calm, quiet, peace; moderation"|oda(yaka)|"calm, quiet, peace; moderation"|6768
1573|鍋|17|"Kane, Kanehen"|33|なべ||-|-|nabe|"pan, pot, kettle"|6753
245|鎌|18|"Kane, Kanehen"|33|かま||‐|-|kama|"sickle, scythe; trick"|6732
150|菓|11|Kusakanmuri|47|カ||ka|"cakes; fruit"|-|-|6696
314|軌|9|"Kuruma, Kurumahen"|15|キ||ki|"wheel track; railway; orbit; rut; rule; model; road, way of doing"|-|-|6684
1811|偏|11|"Hito, Ninben, Hitoyane"|104|ヘン、かたよ-る||hen|"side; left radical of a character; inclining"|katayo(ru)|"lean, incline; be biased "|6674
2003|溶|13|"Mizu, Sanzui, Shitamizu"|118|ヨウ、と-ける、と-かす、と-く||yoo|"melt, dissolve, thaw"|"to(keru), to(kasu), to(ku)"|"melt, dissolve, thaw. liquefy, melt"|6668
793|紫|12|"Ito, Itohen"|63|シ、むらさき||shi|"purple, violet"|murasaki|"purple, violet; soy sauce"|6653
113|殴|8|Rumata|6|オウ、なぐ-る||oo|"hit, beat, thrash"|nagu(ru)|"hit, beat, thrash"|6653
850|煮|12|"Hi, Hihen, Renga"|26|シャ、に-る、に-える、に-やす||sha|"boil, cook, be cooked, be boiled "|"ni(ru), ni(eru), ni(yasu)"|"boil, cook, be cooked, be boiled. boil, cook "|6648
934|盾|9|"Me, Mehen"|19|ジュン、たて||jun|"shield, buckler, escutcheon; pretext"|tate|"shield, buckler, escutcheon; pretext"|6610
1230|桑|10|"Ki, Kihen"|85|ソウ、くわ||soo|mulberry|kuwa|mulberry|6610
145|架|9|"Ki, Kihen"|85|カ、か-ける、か-かる||ka|"frame, mount, stand, support; hang up; shelf"|"ka(keru), ka(karu)"|"build (a bridge), hang"|6608
1509|唐|10|"Kuchi, Kuchihen"|70|トウ、から||too|"Tang (dynasty); China; foreign countries. Chinese; Korean; Foreign"|kara|"China; Cathay; Korea; Foreign countries. Chinese; Korean; Foreign"|6605
1438|呈|7|"Kuchi, Kuchihen"|70|テイ||tei|"offer, present; send (a letter);  exhibit; develop (symptoms); assume (airs)"|-|-|6591
1224|荘|9|Kusakanmuri|47|ソウ|ショウ、ジョウ|soo|"villa, inn"|-|-|6533
833|疾|10|Yamaidare|15|シツ|や|shitsu|"illness, disease"|-|-|6525
783|肢|8|"Niku, Nikuzuki"|44|シ||shi|"limbs, arms and legs"|-|-|6503
30|偉|12|"Hito, Ninben, Hitoyane"|104|イ、えら-い||i|greatness|era(i)|"great, famous, excellent, remarkable"|6493
244|釜|10|"Kane, Kanehen"|33|かま|プ|‐|-|kama|"kettle, cauldron, iron pot; bioler"|6485
1881|墨|14|"Tsuchi, Tsuchihen"|50|ボク、すみ||boku|"India ink, Chinese ink; ink stick; inked marking string; ink (of a squid) "|sumi|"India ink, Chinese ink; ink stick; inked marking string; ink (of a squid) "|6475
1218|壮|6|Samurai|5|ソウ||soo|"manhood; prosperity"|-|-|6473
455|隅|12|Kozatohen|31|グウ、すみ||guu|corner|sumi|"corner, nook"|6440
420|仰|6|"Hito, Ninben, Hitoyane"|104|ギョウ、[コウ]、あお-ぐ、おお-せ||"gyoo, [koo]"|"look up; look up to; ask for, depend on; seek; respect, revere; drink, take"|"ao(gu), oo(se)"|"look up; look up to; ask for, depend on; seek; respect, revere; drink, take; statement, command, wishes (of a superior)"|6430
250|汗|6|"Mizu, Sanzui, Shitamizu"|118|カン、あせ||kan|"be sweaty"|ase|perspiration|6422
1978|猶|12|"Inu, Kemonohen"|17|ユウ|なお|yuu|"further, furthermore, still, still more, yet; just like "|-|-|6413
1096|崇|11|"Yama, Yamahen"|16|スウ|シュウ、たか、あが|suu|high|-|-|6388
1089|酔|11|"Tori, Torihen"|14|スイ、よ-う||sui|"get drunk; feel sick; be poisoned; be elated, be spellbound"|yo(u)|"get drunk; feel sick; be poisoned; be elated, be spellbound"|6346
699|宰|10|Ukanmuri|36|サイ||sai|"manager; rule"|-|-|6346
700|栽|10|"Ki, Kihen"|85|サイ||sai|planting|-|-|6341
11|嵐|12|"Yama, Yamahen"|16|あらし|ラン|-|-|arashi|"storm, tempest"|6337
639|溝|13|"Mizu, Sanzui, Shitamizu"|118|コウ、みぞ||koo|"ditch, gutter, sewer, drain "|mizo|"ditch, gutter, drain; groove, slot; gulf, gap "|6312
157|靴|13|"Kakunokawa, Kawahen"|2|カ、くつ||ka|shoes|kutsu|"shoes, boots"|6310
83|悦|10|"Kokoro, Risshinben, Shitagokoro"|76|エツ|よろこ|etsu|"joy, rapture, ecstasy, amusement"|-|-|6261
664|酷|14|"Tori, Torihen"|14|コク|きび|koku|"severity, cruelty"|-|-|6166
1040|尻|5|Shikabane|15|しり||-|-|shiri|"buttocks, hips; rear or back of a person; bottom(of a kettle); tail end, tag end"|6156
1708|鼻|14|Hana|1|ビ、はな||bi|nasal|hana|"nose; snout, muzzle"|6110
1338|胆|9|"Niku, Nikuzuki"|44|タン|きも、ぎも|tan|"gall bladder; courage"|-|-|6103
1429|墜|15|"Tsuchi, Tsuchihen"|50|ツイ|お|tsui|fall|-|-|6103
1877|朴|6|"Ki, Kihen"|85|ボク|ほお|boku|"simple, plain; docile"|-|-|6090
1459|泥|8|"Mizu, Sanzui, Shitamizu"|118|デイ、どろ|なず|dei|"mud, mire"|doro|"mud, mire, dirt, slush; disgrace"|6089
862|寂|11|Ukanmuri|36|ジャク、[セキ]、さび、さび-しい、さび-れる||"jaku, [seki]"|"quietly; death of a priest"|"sabi, sabi(shii), sabi(reru)"|"patina, antique look; elegant simplicity; trained recite's voice. lonely, lonesome; solitary, deserted, desolate"|6064
957|徐|10|Gyooninben|19|ジョ|おもむ|jo|"slowly, deliberately, gently"|-|-|6055
1853|乏|4|No|4|ボウ、とぼ-しい||boo|"meager, scarce, limited; destitute, hard up "|tobo(shii)|"meager, scarce, limited; destitute, hard up "|6046
1854|忙|6|"Kokoro, Risshinben, Shitagokoro"|76|ボウ、いそが-しい||boo|"busy, occupied"|isoga(shii)|"busy, occupied"|6003
1498|刀|2|"Katana, Rittoo"|32|トウ、かたな|ト|too|"sword, saber, knife, engraving tool"|katana|"sword, blade"|5979
453|偶|11|"Hito, Ninben, Hitoyane"|104|グウ||guu|"even number; couple, man and wife; friend; same kind; doll"|-|-|5943
1866|傍|12|"Hito, Ninben, Hitoyane"|104|ボウ、かたわ-ら|ホウ|boo|"side; besides; while"|katawa(ra)|"side; besides; while"|5937
953|如|6|"Onna, Onnahen"|36|ジョ、ニョ|ごと、し|"jo, 	nyo"|"like, such as, as if"|-|-|5931
1342|嘆|13|"Kuchi, Kuchihen"|70|タン、なげ-く、なげ-かわしい||tan|sigh|"nage(ku), nage(kawashii)"|"sigh, lament, moan, grieve; regret, deplore, sorrow. sad, wretched, deplorable"|5929
340|宜|8|Ukanmuri|36|ギ|よろ、むべ|gi|"good, good-natured; pleasing; precious; noble; lovely, beautiful, fine; lucky; efficacious; right; suitable, justifiable; appropriate, satisfactory; better; all right; unnecessary; no objection; intimate, friendly; easy; well; desirous"|-|-|5920
338|騎|18|"Uma, Umahen"|11|キ||ki|"riding on horses; counter for horsemen"|-|-|5900
473|径|8|Gyooninben|19|ケイ|みち|kei|"path; diameter; method"|-|-|5895
1434|坪|8|"Tsuchi, Tsuchihen"|50|つぼ||-|-|tsubo|"area about 36 square feet"|5882
563|虎|8|Toragashira|5|コ、とら||ko|"tiger, drunkard"|tora|"tiger, drunkard"|5877
1969|癒|18|Yamaidare|15|ユ、い-える、い-やす||yu|"heal, cure; quench (thirst); wreak (vengeance)"|"i(eru), i(yasu)"|"heal, cure; quench (thirst); wreak (vengeance). recover, be healed "|5821
1186|践|13|"Ashi, Ashihen"|11|セン|ふ|sen|"step on, trample on, stamp on; carry through, practice; appraise; set foot on; evade payment"|-|-|5799
2053|粒|11|"Kome, Komehen"|10|リュウ、つぶ||ryuu|"grain, drop"|tsubu|"grain, drop; counter for tiny particles"|5789
1537|洞|9|"Mizu, Sanzui, Shitamizu"|118|ドウ、ほら|トウ|doo|cavity|hora|"cave, den, excavation"|5744
1147|惜|11|"Kokoro, Risshinben, Shitagokoro"|76|セキ、お-しい、お-しむ|シャク|seki|"be sparing of; be frugal with; be stingy with; regret; value, prize; be reluctant "|"o(shii), o(shimu)"|"be sparing of; be frugal with; be stingy with; regret; value, prize; be reluctant. regrettable, pitiful, disappointing; precious; wasteful"|5739
1426|鎮|18|"Kane, Kanehen"|33|チン、しず-める、しず-まる||chin|"ancient garrisons for peace-preservation"|"shizu(meru), shizu(maru)"|"get quiet, calm down, grow still; subside, die down; be suppressed. calm, pacify; soothe, alleviate; appease; suppress, quell"|5731
886|舟|6|"Fune, Funehen"|8|シュウ、ふね、[ふな]||shuu|boat|"fune, [funa]"|"boat, ship, vessel, steamer, liner, barge; shipping; tank, trough, cistern, vat "|5711
1271|俗|9|"Hito, Ninben, Hitoyane"|104|ゾク||zoku|"customs, manners; the world; worldliness; vulgarity; mundane things; the laity"|-|-|5701
2021|羅|19|Amigashira|7|ラ||ra|"silk gauze, thin silk"|-|-|5681
1194|繊|17|"Ito, Itohen"|63|セン||sen|"fine, slender; thin kimono"|-|-|5679
1177|扇|10|"To, Tokanmuri"|6|セン、おうぎ||sen|fan|oogi|"folding fan"|5663
2077|厘|9|Gandare|4|リン||rin|"one-tenth of a sen; one-tenth of a bu"|-|-|5648
168|芽|8|Kusakanmuri|47|ガ、め||ga|"sprout, spear, germ"|me|"sprout, spear, germ"|5645
1950|紋|10|"Ito, Itohen"|63|モン||mon|"crest; (textile) figures"|-|-|5644
1359|恥|10|"Kokoro, Risshinben, Shitagokoro"|76|チ、は-じる、はじ、は-じらう、は-ずかしい||chi|"shame, dishonor, disgrace, humiliation, insult "|"ha(jiru), haji, ha(jirau), ha(zukashii)"|"shame, dishonor, disgrace, humiliation, insult. feel ashamed. feel shy, be coy, be bashful, blush. bashful, ashamed, coy; disgraceful, shameful"|5614
1518|塔|12|"Tsuchi, Tsuchihen"|50|トウ||too|"tower, pagoda, steeple, obelisk, monument"|-|-|5605
1735|瓶|11|Kawara|2|ビン|ヘイ、かめ、がめ|bin|"bottle, vial, jar, flask"|-|-|5566
